id_playlist,id_utilisateur,nom
1,182,imperdiet nullam orci pede venenatis non sodales sed tincidunt
2,137,morbi porttitor lorem id
3,107,viverra pede ac diam cras
4,80,justo maecenas rhoncus aliquam lacus morbi quis tortor id nulla ultrices aliquet
5,49,lorem quisque ut erat curabitur gravida nisi at nibh in
6,73,sem praesent id massa id nisl venenatis lacinia aenean sit
7,299,morbi quis tortor id nulla ultrices
8,130,massa id nisl venenatis lacinia
9,172,nullam varius nulla facilisi cras non velit nec
10,203,at turpis a pede
11,276,at velit vivamus vel nulla eget eros elementum pellentesque quisque porta volutpat
12,101,leo odio porttitor id consequat
13,132,felis eu sapien cursus vestibulum proin eu mi nulla ac enim
15,158,ante nulla justo aliquam quis turpis eget elit sodales
16,172,consequat metus sapien ut nunc vestibulum ante ipsum primis in
17,238,duis ac nibh fusce lacus purus aliquet
18,138,ipsum primis in faucibus
19,168,vel pede morbi porttitor lorem
20,130,posuere cubilia curae donec pharetra magna
21,190,felis sed interdum venenatis turpis enim blandit mi in porttitor pede justo
22,40,habitasse platea dictumst etiam faucibus cursus urna ut tellus nulla
23,168,diam neque vestibulum eget vulputate
24,141,id consequat in consequat
25,190,ipsum aliquam non mauris morbi non lectus aliquam sit amet diam in
26,50,justo aliquam quis turpis eget elit sodales scelerisque mauris sit
27,113,nisi at nibh in hac habitasse
28,20,amet erat nulla tempus vivamus in
29,240,praesent lectus vestibulum quam sapien
30,281,ultrices libero non mattis pulvinar nulla pede ullamcorper
31,25,vel dapibus at diam
32,80,aenean auctor gravida sem praesent id massa
34,149,mauris lacinia sapien quis libero nullam
35,73,vel lectus in quam fringilla
36,239,proin interdum mauris non ligula
37,215,odio cras mi pede malesuada in imperdiet et commodo
38,203,tellus nulla ut erat id mauris
39,62,lacus morbi sem mauris laoreet ut rhoncus aliquet
40,279,curabitur convallis duis consequat dui nec nisi volutpat eleifend
41,158,blandit mi in porttitor pede justo eu massa donec
42,182,donec ut mauris eget massa tempor convallis nulla neque libero
43,102,mus vivamus vestibulum sagittis
44,172,quam pharetra magna ac consequat metus sapien ut
45,40,non mattis pulvinar nulla
46,200,eget rutrum at lorem integer
47,199,quis orci nullam molestie nibh in lectus pellentesque at nulla suspendisse potenti
48,218,ut tellus nulla ut erat id mauris vulputate elementum nullam
49,143,venenatis lacinia aenean sit amet
50,1,primis in faucibus orci luctus et ultrices posuere cubilia
51,101,sapien sapien non mi integer ac neque duis bibendum morbi non
52,149,dapibus duis at velit eu est
53,107,integer pede justo lacinia eget tincidunt eget tempus vel pede morbi
54,238,mi nulla ac enim in tempor turpis nec euismod scelerisque quam
55,135,leo rhoncus sed vestibulum sit amet cursus id turpis integer aliquet massa
56,25,lorem ipsum dolor sit amet consectetuer adipiscing elit proin interdum
57,69,curae nulla dapibus dolor vel
58,211,integer ac neque duis bibendum morbi non quam
59,60,lectus vestibulum quam sapien varius ut blandit non interdum in ante
60,64,at lorem integer tincidunt ante
61,233,pellentesque viverra pede ac diam cras pellentesque volutpat dui maecenas
62,213,ac enim in tempor turpis nec euismod scelerisque
64,233,feugiat et eros vestibulum ac
65,40,ut volutpat sapien arcu
66,168,pede malesuada in imperdiet et commodo vulputate justo in blandit ultrices
67,144,vestibulum sit amet cursus
68,84,luctus cum sociis natoque penatibus et
69,170,integer aliquet massa id lobortis convallis tortor risus dapibus augue vel
70,117,venenatis lacinia aenean sit amet justo morbi ut odio cras
72,292,vel est donec odio justo sollicitudin
73,141,ac enim in tempor turpis nec euismod scelerisque
74,141,amet consectetuer adipiscing elit proin
75,3,molestie sed justo pellentesque viverra
76,223,vestibulum ante ipsum primis in faucibus orci luctus et ultrices posuere cubilia
77,170,iaculis justo in hac habitasse platea dictumst etiam faucibus
78,225,vel enim sit amet nunc viverra dapibus nulla suscipit
79,50,erat eros viverra eget congue
80,299,ligula sit amet eleifend pede libero
81,239,dui vel sem sed sagittis nam congue
82,190,non mattis pulvinar nulla pede ullamcorper
83,182,nisl aenean lectus pellentesque eget nunc donec quis orci eget
85,218,ipsum praesent blandit lacinia erat vestibulum sed magna at nunc commodo
86,161,placerat praesent blandit nam nulla integer pede justo lacinia
87,211,non quam nec dui luctus rutrum nulla
88,62,commodo placerat praesent blandit nam nulla integer pede justo lacinia
89,141,eget semper rutrum nulla nunc purus phasellus in felis donec semper
90,167,cras mi pede malesuada in imperdiet et
91,3,sapien sapien non mi integer ac neque duis bibendum morbi non
93,69,fermentum justo nec condimentum neque sapien placerat ante nulla justo
94,26,morbi vel lectus in quam fringilla rhoncus mauris enim leo rhoncus sed
95,292,in tempor turpis nec euismod
96,169,natoque penatibus et magnis dis parturient montes nascetur ridiculus mus vivamus vestibulum
97,26,accumsan tellus nisi eu orci mauris lacinia sapien
98,243,rutrum rutrum neque aenean auctor gravida sem praesent id
99,132,viverra diam vitae quam suspendisse potenti
100,156,porttitor lacus at turpis donec
101,292,etiam faucibus cursus urna ut tellus nulla ut erat
102,215,faucibus orci luctus et ultrices posuere cubilia curae mauris viverra diam
103,149,sit amet nunc viverra dapibus nulla suscipit
104,62,pretium quis lectus suspendisse potenti in eleifend quam a
105,161,est lacinia nisi venenatis tristique
106,215,praesent id massa id nisl venenatis lacinia
107,130,faucibus orci luctus et ultrices posuere cubilia
108,130,tincidunt eu felis fusce posuere felis sed lacus
109,49,morbi non quam nec dui luctus rutrum nulla
110,290,in magna bibendum imperdiet nullam orci
111,290,in faucibus orci luctus et ultrices posuere cubilia curae nulla dapibus dolor
112,169,amet sapien dignissim vestibulum
113,215,morbi odio odio elementum eu interdum eu tincidunt in leo
114,77,interdum venenatis turpis enim blandit mi in porttitor pede justo eu massa
115,144,id nisl venenatis lacinia aenean sit amet
116,80,pulvinar nulla pede ullamcorper
117,200,platea dictumst aliquam augue quam sollicitudin vitae consectetuer eget
118,290,in faucibus orci luctus
119,192,urna ut tellus nulla ut
120,168,diam neque vestibulum eget vulputate ut ultrices vel augue vestibulum ante
121,26,amet cursus id turpis
122,145,integer a nibh in quis justo maecenas rhoncus aliquam
123,190,ipsum ac tellus semper interdum mauris ullamcorper purus sit amet nulla quisque
124,172,nibh fusce lacus purus aliquet at feugiat non pretium quis lectus
125,56,ut volutpat sapien arcu sed augue
126,138,lorem vitae mattis nibh ligula nec sem
127,60,primis in faucibus orci luctus et ultrices posuere cubilia curae mauris viverra
128,30,nulla mollis molestie lorem quisque ut erat curabitur gravida nisi at
129,137,fusce congue diam id ornare imperdiet sapien urna
130,199,enim sit amet nunc viverra dapibus nulla suscipit
131,188,diam nam tristique tortor eu pede
132,149,in porttitor pede justo eu massa donec
133,167,eu sapien cursus vestibulum proin eu mi nulla ac enim in tempor
134,281,magna vestibulum aliquet ultrices erat tortor sollicitudin mi sit amet lobortis sapien
135,218,tincidunt in leo maecenas pulvinar lobortis est phasellus sit amet
136,256,quis orci nullam molestie nibh in lectus pellentesque at nulla suspendisse potenti
137,299,odio condimentum id luctus nec molestie sed justo pellentesque viverra pede ac
138,218,quis justo maecenas rhoncus aliquam lacus morbi quis tortor id
139,141,amet lobortis sapien sapien
140,292,vestibulum sit amet cursus
141,218,mauris viverra diam vitae quam suspendisse
142,84,quam fringilla rhoncus mauris enim leo rhoncus sed vestibulum
143,105,nulla tellus in sagittis dui
144,50,nulla pede ullamcorper augue a suscipit nulla
145,3,dolor vel est donec odio justo sollicitudin ut
146,1,et magnis dis parturient montes nascetur
147,49,ipsum integer a nibh in quis
148,225,vestibulum velit id pretium iaculis diam erat fermentum
149,73,turpis a pede posuere nonummy integer non
152,102,donec semper sapien a libero nam dui proin leo odio porttitor
153,113,in faucibus orci luctus et
154,3,posuere cubilia curae duis faucibus accumsan odio curabitur convallis
155,221,in faucibus orci luctus et ultrices
156,113,fusce congue diam id ornare imperdiet sapien urna pretium nisl
157,238,nec dui luctus rutrum nulla tellus in sagittis dui vel nisl duis
158,35,orci vehicula condimentum curabitur in libero ut massa volutpat
159,292,ipsum integer a nibh in quis justo maecenas rhoncus aliquam lacus
160,292,erat nulla tempus vivamus in felis
161,182,risus praesent lectus vestibulum quam sapien varius ut blandit non interdum in
162,1,ante ipsum primis in faucibus orci
163,64,sociis natoque penatibus et magnis dis parturient
164,26,vel sem sed sagittis nam congue risus semper porta volutpat quam
165,20,nisl ut volutpat sapien arcu sed augue aliquam erat volutpat in
166,216,non velit donec diam neque
167,149,tristique fusce congue diam id ornare imperdiet sapien urna pretium nisl
168,203,nunc donec quis orci eget orci vehicula condimentum curabitur in libero ut
169,156,vestibulum sit amet cursus id turpis integer aliquet
170,193,pellentesque eget nunc donec quis orci
171,239,in imperdiet et commodo vulputate justo in blandit ultrices enim
172,200,felis ut at dolor quis odio consequat varius integer
173,211,vel enim sit amet nunc viverra dapibus
174,144,consequat ut nulla sed
175,130,ipsum primis in faucibus orci luctus et
176,170,turpis integer aliquet massa
177,21,nisl aenean lectus pellentesque eget
178,292,orci luctus et ultrices posuere cubilia curae donec
179,276,in lacus curabitur at ipsum ac tellus semper interdum mauris ullamcorper
180,233,eget elit sodales scelerisque mauris sit amet eros
181,199,eros viverra eget congue eget
182,60,integer aliquet massa id lobortis convallis tortor risus dapibus augue vel
183,211,pulvinar sed nisl nunc rhoncus dui vel sem sed sagittis nam congue
184,225,id lobortis convallis tortor risus dapibus augue vel accumsan
185,282,dui proin leo odio porttitor id consequat in consequat ut nulla
186,200,nisl venenatis lacinia aenean sit amet justo
187,117,sed magna at nunc commodo placerat praesent blandit nam nulla integer pede
188,73,semper interdum mauris ullamcorper purus sit amet nulla quisque
189,141,habitasse platea dictumst etiam faucibus cursus urna ut tellus
190,80,vehicula condimentum curabitur in libero ut massa volutpat convallis morbi odio odio
191,50,pulvinar lobortis est phasellus sit amet erat
192,282,rutrum rutrum neque aenean auctor gravida sem praesent id massa id
193,170,porttitor lacus at turpis donec
194,276,blandit ultrices enim lorem ipsum dolor
195,69,ultrices posuere cubilia curae mauris viverra diam vitae
196,279,amet consectetuer adipiscing elit proin risus praesent
197,221,velit eu est congue
198,149,fusce congue diam id ornare imperdiet sapien
199,137,nulla facilisi cras non velit nec nisi vulputate nonummy maecenas tincidunt
200,58,mus etiam vel augue vestibulum rutrum
